{
  "$schema": "https://json-schema.org/draft/2020-12/schema",
  "title": "Type Moon World servant",
  "type": "object",
  "required": [
    "class_type",
    "parameters",
    "model",
    "skills"
  ],
  "properties": {
    "id": {
      "type": "string",
      "maxLength": 128
    },
    "display_name": {
      "type": "string",
      "maxLength": 128
    },
    "display_name_zh": {
      "type": "string",
      "maxLength": 128
    },
    "class_type": {
      "type": "string"
    },
    "faction": {
      "type": "string"
    },
    "traits": {
      "type": "array",
      "uniqueItems": true,
      "items": {
        "type": "string"
      }
    },
    "parameters": {
      "type": "object"
    },
    "model": {
      "type": "object",
      "required": [
        "geometry",
        "texture",
        "animation"
      ],
      "properties": {
        "geometry": {
          "type": "string"
        },
        "texture": {
          "type": "string"
        },
        "animation": {
          "type": "string"
        },
        "animations": {
          "type": "object"
        }
      }
    },
    "specialization": {
      "type": "object"
    },
    "skills": {
      "type": "array",
      "items": {
        "type": "string"
      }
    },
    "noble_phantasm": {
      "type": "string"
    },
    "personality": {
      "type": "object"
    },
    "ai_config": {
      "type": "string"
    },
    "spawn_egg": {
      "type": "object",
      "properties": {
        "primary": {
          "type": "integer",
          "minimum": 0,
          "maximum": 16777215
        },
        "secondary": {
          "type": "integer",
          "minimum": 0,
          "maximum": 16777215
        }
      }
    },
    "era": {
      "enum": [
        "mythology",
        "ancient",
        "age_of_sail",
        "early_modern",
        "modern",
        "future"
      ],
      "default": "modern"
    }
  }
}
